<?xml version="1.0" encoding="UTF-8"?>

<movies xmlns:xsi="http://www.w3.org/2001/XMLSchema-instance" xsi:noNamespaceSchemaLocation="external.xsd">

<movie>
    <title> Mr. India </title>
    <year> 2003 </year>
    <genre> Comedy</genre>  

</movie>

<movie>
    <title> Krish</title>
    <year> 2008</year>
    <genre> Romantic </genre>

</movie>
</movies>